,ID,DOI,DOI_API,DOI_retry_API,complete,csv_post_title,title_API,title_retry_API,good_list
1558,389,,None,10.1111/dme.12038,"owen kr, lawrence rd. rd lawrence lecture 2012: assessing aetiology in diabetes: how c-peptide, crp and fucosylation came to the party!.   mar;30(3):260-6.","rd lawrence lecture 2012: assessing aetiology in diabetes: how c-peptide, crp and fucosylation came to the party!",,"RD Lawrence Lecture 2012Assessing aetiology in diabetes: how C-peptide, CRP and fucosylation came to the party!",False
1564,2252,,None,10.1002/ccr3.663,"pagnamenta at, howard mf, knight sj, keays da, quaghebeur g, taylor jc et al. activation of an exonic splice-donor site in exon 30 of cdk5rap2 in a patient with severe microcephaly and pigmentary abnormalities.   oct;4(10):952-6. pubmed pmid: 27761245. pubmed central pmcid: 5054469. epub 23/08/2016.",activation of an exonic splice-donor site in exon 30 of cdk5rap2 in a patient with severe microcephaly and pigmentary abnormalities,,Activation of an exonic splice-donor site in exon 30 ofCDK5RAP2in a patient with severe microcephaly and pigmentary abnormalities,False
1595,1135,,10.1002/ccd.26550,10.1016/j.jcin.2014.04.011,"patel n, de maria gl, kassimis g, rahimi k, bennett d, ludman p et al. outcomes after emergency percutaneous coronary intervention in patients with unprotected left main stem occlusion: the bcis national audit of percutaneous coronary intervention 6-year experience.   sep;7(9):969-80.",outcomes after emergency percutaneous coronary intervention in patients with unprotected left main stem occlusion: the bcis national audit of percutaneous coronary intervention 6-year experience,First-in-human robotic percutaneous coronary intervention for unprotected left main stenosis,Outcomes After Emergency Percutaneous Coronary Intervention in Patients With Unprotected Left Main Stem Occlusion,False
1677,1122,,10.1111/j.1440-1754.2012.02465.x,10.1212/wnl.0000000000000737,"poidvin a, touzå½ e, ecosse e, landier f, bå½jot y, giroud m, rothwell pm, carel jc, coste j., touze e. growth hormone treatment for childhood short stature and risk of stroke in early adulthood..   aug 26(83(9)):780-6.",growth hormone treatment for childhood short stature and risk of stroke in early adulthood.,Debate: Idiopathic short stature should be treated with growth hormone,Growth hormone treatment for childhood short stature and risk of stroke in early adulthood,False
1682,1033,,10.1111/jpc.13856,10.4161/hv.7.8.16270,pollard aj. meningococcal disease prevention in india.   jun 8;51(6):445-6.,meningococcal disease prevention in india,Neonatal meningococcal disease,Meningococcal disease: The advances and challenges of meningococcal disease prevention,False
1697,34,,10.1111/nbu.12102,10.1016/j.bbamcr.2015.11.010,"prendergast b, coope lt, crijns h, falkenstein e, folsch u, halvorsen s, janssens s, jokinen e, kroemer hk, lucke a, murer h, nagel e, neyses l, perk j, probst-hensch n, rietschel et, rutten h, steingen c, tedgui a, gilst w, eschenhagen t, kristensen sd. the german centre for cardiovascular research.   may.",the german centre for cardiovascular research,"Twenty years of research in the Human Nutrition Research Centre, Newcastle University, 1994-2014",Heart regeneration,False
1698,684,,10.1111/jocs.12732,10.1038/nrcardio.2013.130,"prendergast b, harrison j. valve disease: is early surgery beneficial in prosthetic valve endocarditis?.   oct;10(10):556-7.",valve disease: is early surgery beneficial in prosthetic valve endocarditis?,Prosthetic Valve Endocarditis Following Dental Extractions,Is early surgery beneficial in prosthetic valve endocarditis?,False
1729,1232,,None,10.3727/096368914x685320,"ramnath rd, maillard e, jones k, bateman pa, hughes ss, gralla j, johnson pr, gray dw. in vitro assessment of human islet vulnerability to instant blood mediated inflammatory reaction (ibmir) and its use to demonstrate a beneficial effect of tissue culture.   nov 5.",in vitro assessment of human islet vulnerability to instant blood mediated inflammatory reaction (ibmir) and its use to demonstrate a beneficial effect of tissue culture,,In Vitro Assessment of Human Islet Vulnerability to Instant Blood-Mediated Inflammatory Reaction (IBMIR) and Its Use to Demonstrate a Beneficial Effect of Tissue Culture,False
1730,1326,,None,10.1056/nejmc1505499,"rampling t, ewer k, bowyer g, wright d, imoukhuede eb, payne r et al. a monovalent chimpanzee adenovirus ebola vaccine  -  preliminary report.   jan 28. [epub ahead.",a monovalent chimpanzee adenovirus ebola vaccine  -  preliminary report,,Chimpanzee Adenovirus Vector Ebola Vaccine — Preliminary Report,False
1731,2042,10.1093/infdis/jiw244,None,10.3389/fimmu.2018.01660,"rampling t, ewer kj, bowyer g, bliss cm, edwards nj, wright d et al. safety and high level efficacy of the combination malaria vaccine regimen of rts,s/as01b with chad-mva vectored vaccines expressing me-trap.   sep;214(5):772-81. doi: 10.1093/infdis/jiw244. epub 2016 jun 15.","safety and high level efficacy of the combination malaria vaccine regimen of rts,s/as01b with chad-mva vectored vaccines expressing me-trap",,"CXCR3+ T Follicular Helper Cells Induced by Co-Administration of RTS,S/AS01B and Viral-Vectored Vaccines Are Associated With Reduced Immunogenicity and Efficacy Against Malaria",False
1733,1056,,None,10.1177/1471301215615780,"rand l, sheehan m. healthcare resource allocation: balancing principles and practices for dementia.   jul. in c. foster, j. herring and i. doron (eds.) the law and ethics of dementia. oxford: hart.",healthcare resource allocation: balancing principles and practices for dementia,,"Charles Foster, Jonathan Herring and Israel Doron (eds), The law and ethics of dementia",False
1734,504,10.1371/journal.pgen.1003500,None,10.1093/bioinformatics/btu621,"randall jc, winkler tw, kutalik z, berndt si, jackson au, monda kl et al. sex-stratified genome-wide association studies including 270,000 individuals show sexual dimorphism in genetic loci for anthropometric traits.   jun;9(6):e1003500. doi: 10.1371/journal.pgen.1003500.","sex-stratified genome-wide association studies including 270,000 individuals show sexual dimorphism in genetic loci for anthropometric traits",,EasyStrata: evaluation and visualization of stratified genome-wide association meta-analysis data,False
1746,439,,None,,"reesink hw, davis k, wong j, schwartz dw, mayr wr, devine dv et al. the use of the electronic (computer) cross-match.   may;104(4):350-64.",the use of the electronic (computer) cross-match,,,False
1747,1025,10.1111/psyp.12197,None,,"reiser em, weiss em, schulter g, holmes ea, fink a, papousek i. prefrontal-posterior coupling while observing the suffering of other people, and the development of intrusive memories.   jun;51(6):546-55. doi: 10.1111/psyp.12197. epub 2014 feb 24.","prefrontal-posterior coupling while observing the suffering of other people, and the development of intrusive memories",,,False
1748,1434,10.1371/journal.pgen.1005061,None,,"reschen me, gaulton kj, lin d, soilleux ej, morris aj, smyth ss, o'callaghan ca. lipid-induced epigenomic changes in human macrophages identify a coronary artery disease associated variant that regulates ppap2b expression through altered c/ebp-beta binding.   apr 2;11(4). e1005061. doi: 10.1371/journal.pgen.1005061. ecollection 2015..",lipid-induced epigenomic changes in human macrophages identify a coronary artery disease associated variant that regulates ppap2b expression through altered c/ebp-beta binding,,,False
1749,118,10.1038/mt.2012.25,None,,"reyes-sandoval a, rollier cs, milicic a, bauza k, cottingham mg, tang ck, dicks md, wang d, longley rj, wyllie dh, hill av. mixed vector immunization with recombinant adenovirus and mva can improve vaccine efficacy while decreasing antivector immunity.   aug;20(8):1633-47. doi: 10.1038/mt.2012.25. epub 2012 feb 21.",mixed vector immunization with recombinant adenovirus and mva can improve vaccine efficacy while decreasing antivector immunity,,,False
1750,1230,,None,,"reynolds cj, jones c, blohmke cj, darton tc, goudet a, sergeant r et al. the serodominant secreted effector protein of salmonella, sseb, is a strong cd4 antigen containing an immunodominant epitope presented by diverse hla class ii alleles.   nov;143(3):438-46.","the serodominant secreted effector protein of salmonella, sseb, is a strong cd4 antigen containing an immunodominant epitope presented by diverse hla class ii alleles",,,False
1751,1006,,None,,"richens jl, vere ka, light ra, soria d, garibaldi j, smith ad, warden d, wilcock g, bajaj n, morgan k, o'shea p. practical detection of a definitive biomarker panel for alzheimer' s disease; comparisons between matched plasma and cerebrospinal fluid.   may 29;5(2):53-70.",practical detection of a definitive biomarker panel for alzheimer's disease; comparisons between matched plasma and cerebrospinal fluid,,,False
1752,1439,10.1371/journal.pone.0119605,None,,"ricigliano va, handel ae, sandve gk, annibali v, ristori g, mechelli r, cader mz, salvetti m. ebna2 binds to genomic intervals associated with multiple sclerosis and overlaps with vitamin d receptor occupancy.   apr 8;10(4). doi: 10.1371/journal.pone.0119605.",ebna2 binds to genomic intervals associated with multiple sclerosis and overlaps with vitamin d receptor occupancy,,,False
1753,1116,10.1016/j.vaccine.2014.04.022,None,,"rid a, saxena a, baqui ah, bhan a, bines j, bouesseau mc, caplan a, colgrove j, dhai a, gomez-diaz r, green sk, kang g, lagos r, loh p, london aj, mulholland k, neels p, pitisuttithum p, sarr sc, selgelid m, sheehan m, smith pg. placebo use in vaccine trials: recommendations of a who expert panel.   aug 20;32(37):4708-12. doi:10.1016/j.vaccine.2014.04.022.",placebo use in vaccine trials: recommendations of a who expert panel,,,False
1754,1200,,None,,"rider oj, ajufo e, ali mk, petersen se, nethononda r, francis jm et al. myocardial tissue phase mapping reveals impaired myocardial tissue velocities in obesity.   oct 11.",myocardial tissue phase mapping reveals impaired myocardial tissue velocities in obesity,,,False
1755,1111,,None,,"rider oj, asaad m, ntusi n, wainwright e, clutton g, hancock g et al. hiv is an independent predictor of aortic stiffness.   aug 16;16(1):57.",hiv is an independent predictor of aortic stiffness,,,False
1756,78,,None,,"rider oj, byrne jp, neubauer s. obesity and the heart: cardiovascular magnetic resonance imaging evidence of the beneficial effects of bariatric surgery.   jul.",obesity and the heart: cardiovascular magnetic resonance imaging evidence of the beneficial effects of bariatric surgery,,,False
1757,158,,None,,"rider oj, cox p, tyler d, clarke k, neubauer s. myocardial substrate metabolism in obesity.   oct.",myocardial substrate metabolism in obesity,,,False
1758,251,,None,,"rider oj, francis jm, tyler d, byrne j, clarke k, neubauer s. effects of weight loss on myocardial energetics and diastolic function in obesity.   dec.",effects of weight loss on myocardial energetics and diastolic function in obesity,,,False
1759,32,,None,,"rider oj, holloway cj, emmanuel y, bloch e, clarke k, neubauer s. increasing plasma free fatty acids in healthy subjects induces aortic distensibility changes seen in obesity.   may.",increasing plasma free fatty acids in healthy subjects induces aortic distensibility changes seen in obesity,,,False
1760,188,,None,,"rider oj, lewandowski a, nethononda r, petersen se, francis jm, pitcher a, holloway cj, dass s, banerjee r, byrne jp, leeson p, neubauer s. gender-specific differences in left ventricular remodelling in obesity: insights from cardiovascular magnetic resonance imaging.   oct.",gender-specific differences in left ventricular remodelling in obesity: insights from cardiovascular magnetic resonance imaging,,,False
1761,1327,,None,,"rider oj, lewis aj, lewandowski aj, ntusi n, nethononda r, petersen se et al. obese subjects show sex-specific differences in right ventricular hypertrophy.   jan 30;8(1).",obese subjects show sex-specific differences in right ventricular hypertrophy,,,False
1762,182,,None,,"rider oj, nethononda r, petersen se, francis jm, byrne jp, leeson p, clarke k, neubauer s. concentric left ventricular remodeling and aortic stiffness: a comparison of obesity and hypertension.   oct.",concentric left ventricular remodeling and aortic stiffness: a comparison of obesity and hypertension,,,False
1763,2083,10.1136/heartjnl-2015-309201,None,,"rider oj, ntusi n, bull sc, nethononda r, ferreira v, holloway cj, holdsworth d, mahmod m, rayner jj, banerjee r, myerson s, watkins h, neubauer s. improvements in ecg accuracy for diagnosis of left ventricular hypertrophy in obesity.   aug:pii: heartjnl-2015-309201. doi: 10.1136/heartjnl-2015-309201. [epub ahead of print].",improvements in ecg accuracy for diagnosis of left ventricular hypertrophy in obesity,,,False
1764,449,,None,,"rider oliver j, neubauer s. letter by rider and neubauer regarding article, ""cardiac remodeling in obesity"".   may 1;6(3):e17.","letter by rider and neubauer regarding article, ""cardiac remodeling in obesity""",,,False
1765,1855,10.1002/art.39515,None,,"ridley a, hatano h, wong-baeza, shaw j, matthews kk, al-mossawi h, ladell k, price da, bowness p, kollnberger s.. activation-induced kir3dl2 binding to hla-b27 licenses pathogenic t cell differentiation in spondyloarthritis.   apr;68(4):901-14. doi: 10.1002/art.39515..",activation-induced kir3dl2 binding to hla-b27 licenses pathogenic t cell differentiation in spondyloarthritis,,,False
1766,2297,10.1038/ncomms13357,None,,"ried js, jeff mj, chu ay, bragg-gresham jl, van dongen j, huffman je. a principal component meta-analysis on multiple anthropometric traits identifies novel loci for body shape.   nov 23;7:13357. doi: 10.1038/ncomms13357.",a principal component meta-analysis on multiple anthropometric traits identifies novel loci for body shape,,,False
1767,1288,,None,,"riefflin a, ayyagari u, manley se, holman rr, levy jc. the effect of glibenclamide on insulin secretion at normal glucose concentrations.   jan;58(1):43-9.",the effect of glibenclamide on insulin secretion at normal glucose concentrations,,,False
1768,1096,10.1038/ng.3036,None,,"rimmer a, phan h, mathieson i, iqbal z, twigg sr, wgs500 consortium, wilkie ao, mcvean g, lunter g. integrating mapping-, assembly- and haplotype-based approaches for calling variants in clinical sequencing applications.   aug;46(8):912-8 . doi: 10.1038/ng.3036. epub ahead of print jul 13.","integrating mapping-, assembly- and haplotype-based approaches for calling variants in clinical sequencing applications",,,False
1769,1368,10.1016/j.bbmt.2014.11.009,None,,"rio b, chevret s, vigouroux s, chevallier p, fã•_rst s, sirvent a, bay jo, sociå½ g, ceballos p, huynh a, cornillon j, franã•_oise s, legrand f, yakoub-agha i, michel g, maillard n, margueritte g, maury s, uzunov m, bulabois ce, michallet m, clement l, dauriac c, bilger k, gluckman e, ruggeri a, buzyn a, nguyen s, simon t, milpied n, rocha v, furst s, socie g. decreased nonrelapse mortality after unrelated cord blood transplantation for acute myeloid leukemia using reduced-intensity conditioning: a prospective phase ii multicenter trial.   mar;21(3):445-53. doi 10.1016/j.bbmt.2014.11.009.",decreased nonrelapse mortality after unrelated cord blood transplantation for acute myeloid leukemia using reduced-intensity conditioning: a prospective phase ii multicenter trial,,,False
1770,683,,None,,"ritchie r, collin jrt, coussios c-c, leslie t. attenuation and defocusing of hifu therapy through peri-nephric fat.   oct. in press.",attenuation and defocusing of hifu therapy through peri-nephric fat,,,False
1771,414,,None,,"robert c, dummer r, gutzmer r, lorigan p, kim kb, nyakas m, arance a, liszkay  g, schadendorf d, cantarini m, spencer s, middleton mr, liszkay g. phase 2 double-blind, randomised study of selumetinib plus dacarbazine versus placebo plus dacarbazine as first-line treatment for braf mutant metastatic melanoma.   apr;14(8):733-40.","phase 2 double-blind, randomised study of selumetinib plus dacarbazine versus placebo plus dacarbazine as first-line treatment for braf mutant metastatic melanoma",,,False
1772,1806,10.1136/annrheumdis-2015-208640,None,,"roberts ar, vecellio m, chen l, ridley a, cortes a, knight jc, bowness p, cohen cj, wordsworth bp.. an ankylosing spondylitis-associated genetic variant in  the il23r-il12rb2 intergenic region modulates enhancer activity and is associated with increased th1-cell differentiation..   feb 25. pii: annrheumdis-2015-208640. doi: 10.1136/annrheumdis-2015-208640. [epub ahead of print].",an ankylosing spondylitis-associated genetic variant in  the il23r-il12rb2 intergenic region modulates enhancer activity and is associated with increased th1-cell differentiation.,,,False
1773,1353,10.1371/journal.pgen.1004914,None,,"roberts he, hurst j, robinson n, brown h, flanagan p, vass l, fidler s, weber j, babiker a, phillips re, mclean ar, frater j; spartac trial investigators.. structured observations reveal slow hiv-1 ctl escape.   feb 6;11(2). doi: 10.1371/journal.pgen.1004914. ecollection 2015.",structured observations reveal slow hiv-1 ctl escape,,,False
1774,772,,None,,"roberts i, alford k, hall g, juban g, richmond h, norton a et al. gata1-mutant clones are frequent and often unsuspected in babies with down syndrome: identification of a population at risk of leukemia.   dec;10:10.",gata1-mutant clones are frequent and often unsuspected in babies with down syndrome: identification of a population at risk of leukemia,,,False
1775,773,,None,,"roberts i, o'connor d, roy a, cowan g, vyas p. the impact of trisomy 21 on foetal haematopoiesis.   dec;51(4):277-81.",the impact of trisomy 21 on foetal haematopoiesis,,,False
1776,2319,,None,,"robey, r. c., drysdale, s. b., kelly, d. f., bowler, i. c., & sadarangani, m. (2017). age-specific trends in antibiotic resistance in escherichia coli infections in oxford, united kingdom 2013–2014. journal of infection, 74(2), 195-198.",age-specific trends in antibiotic resistance in escherichia coli infections in oxford,,,False
1777,1222,10.1016/j.bbmt.2014.06.011,None,,"robin m, giannotti f, deconinck e, mohty m, michallet m, sanz g, chevallier p, cahn jy, legrand f, rovira m, passweg j, sierra j, nguyen s, maillard n, yakoub-agha i, linkesch w, cannell p, marcatti m, bay jo, chalandon y, krã•_ger n, gluckman e, rocha v, olavarria e, ruggeri a. unrelated cord blood transplantation for patients with primary or secondary myelofibrosis.   nov;20(11):1841-6. doi 10.1016/j.bbmt.2014.06.011.",unrelated cord blood transplantation for patients with primary or secondary myelofibrosis,,,False
1778,2233,10.1111/anae.13601,None,,"robinson ja, purple rj, cole p, zaiwalla z, wulff k, pattinson kts. sleep disturbance in patients taking opioid medication for chronic back pain.   nov;71:1296-1307. doi:10.1111/anae.13601.",sleep disturbance in patients taking opioid medication for chronic back pain,,,False
1779,1445,10.1136/annrheumdis-2015-207416,None,,"robinson pc, costello me, leo p, bradbury la, hollis k, cortes a, lee s, joo kb, shim sc, weisman m, ward m, zhou x, garchon hj8, chiocchia g, nossent j, lie ba, fã•ã´rre ã•ã‰, tuomilehto j, laiho k, jiang l, liu y, wu x, elewaut d, burgos-vargas r, gensler ls, stebbings s, haroon n, mulero j, fernandez-sueiro jl, gonzalez-gay ma, lopez-larrea c, bowness p, gafney k, gaston js, gladman dd, rahman p, maksymowych wp, xu h, van der horst-bruinsma ie, chou ct, valle-oã•â±ate r, romero-sã•ânchez mc, hansen im, pimentel-santos fm, inman rd, martin j, breban m, evans d, reveille jd, kim th, wordsworth bp, brown ma.. erap2 is associated with ankylosing spondylitis in hla-b27-positive and hla-b27-negative patients.   apr 27. doi: 10.1136/annrheumdis-2015-207416. epub 2015 apr 27..",erap2 is associated with ankylosing spondylitis in hla-b27-positive and hla-b27-negative patients,,,False
1780,579,,None,,"robson md, piechnik sk, tunnicliffe em, neubauer s. t measurements in the human myocardium: the effects of magnetization transfer on the sasha and molli sequences.   jul 15.",t measurements in the human myocardium: the effects of magnetization transfer on the sasha and molli sequences,,,False
1781,440,,None,,"rocha v, labopin m, ruggeri a, podesta m, gallamini a, bonifazi f et al. unrelated cord blood transplantation: outcomes after single-unit intrabone injection compared with double-unit intravenous injection in patients with hematological malignancies.   may;95(10):1284-91.",unrelated cord blood transplantation: outcomes after single-unit intrabone injection compared with double-unit intravenous injection in patients with hematological malignancies,,,False
1782,844,10.3109/07420528.2013.843542,None,,"rock p, goodwin g, harmer c, wulff k. daily rest-activity patterns in the bipolar phenotype: a controlled actigraphy study.   mar;31(2):290-296. doi: 10.3109/07420528.2013.843542.",daily rest-activity patterns in the bipolar phenotype: a controlled actigraphy study,,,False
1783,1844,10.1177/0269881115626336,None,,"rock pl, goodwin gm, wulff k, mctavish sf, harmer cj. effects of short-term quetiapine treatment on emotional processing, sleep and circadian rhythms..   mar;30(3):273-82. doi: 10.1177/0269881115626336. epub 2016 feb 11..","effects of short-term quetiapine treatment on emotional processing, sleep and circadian rhythms.",,,False
1784,1088,,None,,"rodgers ct, clarke wt, snyder c, vaughan jt, neubauer s, robson md. human cardiac 31p magnetic resonance spectroscopy at 7 tesla.   aug;72(2):304-15.",human cardiac 31p magnetic resonance spectroscopy at 7 tesla,,,False
1785,697,10.1016/j.vaccine.2013.08.009,None,,"rodgers gl, esposito s, principi n, gutierrez-brito m, diez-domingo j, pollard aj, snape md, martinã•_n-torres f, gruber wc, patterson s, thompson a, gurtman a, paradiso p, scott da. immune response to 13-valent pneumococcal conjugate vaccine with a reduced dosing schedule.   oct;31(42):4765-74. doi: 10.1016/j.vaccine.2013.08.009. epub 2013 aug 16.",immune response to 13-valent pneumococcal conjugate vaccine with a reduced dosing schedule,,,False
1786,584,,None,,"rodrigues ca, rocha v, dreger p, brunstein cg, sengeloev h, finke j et al. alternative donor hematopoietic stem cell transplantation for mature lymphoid malignancies after reduced-intensity conditioning regimen: similar outcomes with umbilical cord blood and unrelated donor peripheral blood.   aug;9:9.",alternative donor hematopoietic stem cell transplantation for mature lymphoid malignancies after reduced-intensity conditioning regimen: similar outcomes with umbilical cord blood and unrelated donor peripheral blood,,,False
1787,57,10.1371/journal.pone.0038434,None,,"roestenberg m, o'hara ga, duncan cj, epstein je, edwards nj, scholzen a, van der ven aj, hermsen cc, hill av, sauerwein rw. comparison of clinical and parasitological data from controlled human malaria infection trials.   jun;7(6):e38434. doi: 10.1371/journal.pone.0038434. epub 2012 jun 11.",comparison of clinical and parasitological data from controlled human malaria infection trials,,,False
1788,955,,None,,"rogers a, nesbit ma, hannan fm, howles sa, gorvin cm, cranston t, allgrove j, bevan js, bano g, brain c, datta v, grossman ab, hodgson sv, izatt l, millar-jones l, pearce sh, robertson l, selby pl, shine b, snape k, warner j, thakker rv. mutational analysis of the adaptor protein 2 sigma subunit (ap2s1) gene: search for autosomal dominant hypocalcemia type 3 (adh3).   apr 7. epub ahead of print.",mutational analysis of the adaptor protein 2 sigma subunit (ap2s1) gene: search for autosomal dominant hypocalcemia type 3 (adh3),,,False
1789,631,,None,,"rohrbacher h, blackwell se, holmes ea, reinecke a. optimizing the ingredients for imagery-based interpretation bias modification for depressed mood: is self-generation more effective than imagination alone?.   sep. [epub ahead of print].",optimizing the ingredients for imagery-based interpretation bias modification for depressed mood: is self-generation more effective than imagination alone?,,,False
1790,755,,10.1002/mds.25441,,"rolinski m, ben-shlomo y, szewczyk-krolikowski k, tomlinson p, nithi k, murray c, talbot k, hu mt, ben-shlomo y. rem sleep behavior disorder is associated with worse non-motor characteristics in an early parkinson' s disease cohort.   nov.",rem sleep behavior disorder is associated with worse non-motor characteristics in an early parkinson's disease cohort,Plasma urate in REM sleep behavior disorder,,False
1791,1826,10.1016/j.nicl.2015.04.003,10.1002/hbm.23299,,"rolinski m, griffanti l, szewczyk-krolikowski k, menke r, wilcock g, filippini n, zamboni g, hu mt, mackay ce. aberrant functional connectivity within the basal ganglia of patients with parkinson' s disease.   apr 9;8:126-32. doi: 10.1016/j.nicl.2015.04.003. ecollection 2015.",aberrant functional connectivity within the basal ganglia of patients with parkinson's disease,Longitudinal changes in functional connectivity of cortico-basal ganglia networks in manifests and premanifest huntington's disease,,False
1793,1300,10.1517/14712598.2015.983897,None,,"rollier cs, dold c, marsay l, sadarangani m, pollard aj. the capsular group b meningococcal vaccine, 4cmenb : clinical experience and potential efficacy.   jan;15(1):131-42. doi: 10.1517/14712598.2015.983897.","the capsular group b meningococcal vaccine, 4cmenb : clinical experience and potential efficacy",,,False
