,ID,DOI,DOI_API,DOI_retry_API,complete,csv_post_title,title_API,title_retry_API,good_list
750,1485,10.1016/S0140-6736(15)60692-4,10.1001/jamaoncol.2018.2706,10.1200/jco.2018.36.15_suppl.1568,"global burden of disease study 2013 collaborators. global, regional, and national incidence, prevalence, and years lived with disability for 301 acute and chronic diseases and injuries in 188 countries, 1990-2013: a systematic analysis for the global burden of disease study 2013.   aug;386(9995):743-800. doi: 10.1016/s0140-6736(15)60692-4. epub 2015 jun 7..","global, regional, and national incidence, prevalence, and years lived with disability for 301 acute and chronic diseases and injuries in 188 countries, 1990-2013: a systematic analysis for the global burden of disease study 2013","Global, Regional, and National Cancer Incidence, Mortality, Years of Life Lost, Years Lived With Disability, and Disability-Adjusted Life-Years for 29 Cancer Groups, 1990 to 2016","Global, regional, and national cancer incidence, mortality, years of life lost, years lived with disability, and disability-adjusted life-years for 29 cancer groups, 2006 to 2016: A systematic analysis for the Global Burden of Disease study.",False
803,1935,10.1038/nature14347,10.1002/tre.466,10.1016/j.urolonc.2016.02.004,"gundem g, van loo p, kremeyer b, alexandrov lb, tubio jm1, papaemmanuil e, brewer ds, kallio hm, hã¶gnã¤s g, annala m, kivinummi k, goody v, latimer c, o'meara s, dawson kj, isaacs w, emmert-buck mr, nykter m, foster c, kote-jarai z, easton d, whitaker hc, icgc prostate uk group, neal de, cooper cs, eeles ra, visakorpi t, campbell pj, mcdermott u, wedge dc, bova gs. the evolutionary history of lethal metastatic prostate cancer..   apr;520(7547):353-7. doi: 10.1038/nature14347. epub 2015 apr 1.",the evolutionary history of lethal metastatic prostate cancer.,Treatment of metastatic prostate cancer,"Commentary on “The evolutionary history of lethal metastatic prostate cancer.” Gundem G, Van Loo P, Kremeyer B, Alexandrov LB, Tubio JM, Papaemmanuil E, Brewer DS, Kallio HM, Högnäs G, Annala M, Kivinummi K, Goody V, Latimer C, O’Meara S, Dawson KJ, Isaacs W, Emmert-Buck MR, Nykter M, Foster C, Kote-Jarai Z, Easton D, Whitaker HC, ICGC Prostate UK Group, Neal DE, Cooper CS, Eeles RA, Visakorpi T, Campbell PJ, McDermott U, Wedge DC, Bova GS, University of Washington—Urology, Seattle, WA . Nature 2015; 520(7547):353-7.",False
809,1252,,10.1111/j.1600-0625.2012.01455.x,10.1111/j.1600-0625.2011.01412.x,"gutowska-owsiak d, salimi m, selvakumar ta, wang x, taylor s, ogg gs.. histamine exerts multiple effects on expression of genes associated with epidermal barrier function.   dec;24(4):231-9.",histamine exerts multiple effects on expression of genes associated with epidermal barrier function,Topical hesperidin improves epidermal permeability barrier function and epidermal differentiation in normal murine skin,IL-17 downregulates filaggrin and affects keratinocyte expression of genes associated with cellular adhesion,False
814,2098,10.1016/S2352-3018(16)30087-X,10.1097/01.ogx.0000511935.64476.66,10.1097/01.ogx.0000511935.64476.66,"h., gbd 2015 hiv collaborators, wang h, wolock tm, carter a, nguyen g, kyu hh et al. estimates of global, regional, and national incidence, prevalence, and mortality of hiv, 1980-2015: the global burden of disease study 2015.   aug;3(8):e361-87. doi: 10.1016/s2352-3018(16)30087-x. epub 2016 jul 19.","estimates of global, regional, and national incidence, prevalence, and mortality of hiv, 1980-2015: the global burden of disease study 2015","Global, Regional, and National Levels of Maternal Mortality, 1990–2015","Global, Regional, and National Levels of Maternal Mortality, 1990–2015",False
823,2076,10.1093/ije/dyv094,10.1002/ana.24281,10.1016/j.respe.2018.05.016,hagg s et al. adiposity as a cause of cardiovascular disease: a mendelian randomization study.   sep 5;44(2):578-86. doi: 10.1093/ije/dyv094.,adiposity as a cause of cardiovascular disease: a mendelian randomization study,Mendelian randomization of serum urate and parkinson disease progression,Circulating antioxidants and Alzheimer's disease prevention: A Mendelian randomization study,False
835,1098,,10.1111/bjd.12166,10.1210/jc.2014-1270,"hamilton a, newby pr, carr-smith jd, disanto g, allahabadia a, armitage m, brix th, chatterjee k, connell jm, hegedus l, hunt pj, lazarus jh, pearce sh, robinson bg, taylor jc, vaidya b, wass ja, wiersinga wm, weetman ap, ramagopalan s, franklyn ja, gough sc, simmonds mj. impact of month of birth on the development of autoimmune thyroid disease in the uk and europe.   aug;99(8):e1459-65.",impact of month of birth on the development of autoimmune thyroid disease in the uk and europe,Autoimmune thyroid disease in vitiligo: multivariate analysis indicates intricate pathomechanisms,Impact of Month of Birth on the Development of Autoimmune Thyroid Disease in the United Kingdom and Europe,False
864,674,,10.1111/j.1365-2362.2011.02574.x,10.1161/circulationaha.113.002717,"hata j, arima h, rothwell pm, woodward m, zoungas s, anderson c, patel a, neal b, glasziou p, hamet p, mancia g, poulter n, williams b, macmahon s, chalmers j; advance collaborative group. effects of visit-to-visit variability in systolic blood pressure on macrovascular and microvascular complications in patients with type 2 diabetes mellitus: the advance trial.   sep 17;128(12):1325-24.",effects of visit-to-visit variability in systolic blood pressure on macrovascular and microvascular complications in patients with type 2 diabetes mellitus: the advance trial,Visit-to-visit variability in blood pressure strongly predicts all-cause mortality in patients with type 2 diabetes: a 5·5-year prospective analysis,Effects of Visit-to-Visit Variability in Systolic Blood Pressure on Macrovascular and Microvascular Complications in Patients With Type 2 Diabetes Mellitus,False
906,21,,10.1111/imj.13060,10.1038/ki.2011.413,"hirst ja, taylor ks, stevens rj, blacklock cl, roberts nw, pugh cw, farmer aj. the impact of renin-angiotensin-aldosterone system inhibitors on type 1 and type 2 diabetic patients.   apr;81:674-83.",the impact of renin-angiotensin-aldosterone system inhibitors on type 1 and type 2 diabetic patients,Use of renin angiotensin system inhibitors in patients with chronic kidney disease,The impact of renin–angiotensin–aldosterone system inhibitors on Type 1 and Type 2 diabetic patients with and without early diabetic nephropathy,False
926,581,,10.1002/iid3.135,10.1016/j.jacc.2013.09.074,"holmes mv, simon t, exeter hj, folkersen l, asselbergs fw, guardiola m et al. secretory phospholipase a2-iia and cardiovascular disease: a mendelian randomization study.   jul 19.",secretory phospholipase a2-iia and cardiovascular disease: a mendelian randomization study,Secretory phospholipase A2 in the pathogenesis of acute dengue infection,Limits of Mendelian Randomization Analyses in Selection of Secretory Phospholipase A2-IIA as a Valid Therapeutic Target for Prevention of Cardiovascular Disease,False
933,863,,10.1111/irv.12024,10.1093/cid/cit692,"hoschler k, andrews nj, faust sn, finn a, pollard aj, snape md et al. administration of as03b-adjuvanted a(h1n1)pdm09 vaccine in children aged.   jan;58(2):181-7.",administration of as03b-adjuvanted a(h1n1)pdm09 vaccine in children aged,Influence of renal replacement therapy on immune response after one and two doses of the A(H1N1) pdm09 vaccine,Administration of AS03B-adjuvanted A(H1N1)pdm09 Vaccine in Children Aged <3 Years Enhances Antibody Response to H3 and B Viruses Following a Single Dose of Trivalent Vaccine One Year Later,False
938,981,10.3978/j.issn.2225-319X.2014.05.14,10.1002/bjs.8840,10.1002/bjs.9838,"howard dp, sideso e, handa a, rothwell pm. incidence, risk factors, outcome and projected future burden of acute aortic dissection.   may;3(3):278-84. doi: 10.3978/j.issn.2225-319x.2014.05.14.","incidence, risk factors, outcome and projected future burden of acute aortic dissection",Acute aortic dissection type A,"Age-specific incidence, risk factors and outcome of acute abdominal aortic aneurysms in a defined population",False
952,1936,,10.1002/bjs.10717,10.1159/000444651,"huibers a, de borst gj, thomas dj, moll fl, bulbulia r, halliday a, acst-1 collaborative group. the mechanism of procedural stroke following carotid endarterectomy within the asymptomatic carotid surgery trial 1..   apr;42(3-4):178-185. epub ahead of print.",the mechanism of procedural stroke following carotid endarterectomy within the asymptomatic carotid surgery trial 1.,Meta-analysis of the procedural risks of carotid endarterectomy and carotid artery stenting over time,The Mechanism of Procedural Stroke Following Carotid Endarterectomy within the Asymptomatic Carotid Surgery Trial 1,False
963,850,10.1016/B978-0-444-63274-6.00018-7,10.1002/term.2113,10.1227/neu.0b013e318231d789,"hyam ja, aziz tz, green al. control of the lungs via the human brain using neurosurgery.   jan;209:341-66. doi: 10.1016/b978-0-444-63274-6.00018-7.",control of the lungs via the human brain using neurosurgery,Giving new life to old lungs: methods to produce and assess whole human paediatric bioengineered lungs,Controlling the Lungs Via the Brain,False
977,2324,,10.1111/j.1600-0447.2011.01780.x,10.1136/bmjopen-2016-012356,"iro, m. a., sadarangani, m., absoud, m., chong, w. k., clark, c. a., easton, a., ... & solomon, t. (2016). immunoglobulinin the treatment of encephalitis (ignite): protocol for a multicentre randomised controlled trial. bmj open, 6(11), e012356.",immunoglobulin in the treatment of encephalitis (ignite): protocol for a multicentre randomised controlled trial,A randomised controlled trial of the efficacy of supported employment,"I
            mmuno
            g
            lobuli
            N
            i
            n the
            T
            reatment of
            E
            ncephalitis (IgNiTE): protocol for a multicentre randomised controlled trial",False
978,1408,,10.1111/iju.12660,10.1016/j.urolonc.2014.08.007,"isbarn h, briganti b, de visschere pj, fã•_tterer j, ghadjar p, giannarini g, ost p, ploussard g, sooriakumaran p, surcel c, van oort i, yossepowitch o, van den bergh r. systematic ultrasound-guided saturation and template biopsy of the prostate: indications and advantages of extended sampling.   apr;68(3):296-306.",systematic ultrasound-guided saturation and template biopsy of the prostate: indications and advantages of extended sampling,Transperineal template-guided mapping biopsy of the prostate,Prognostic effect of neuroendocrine differentiation in prostate cancer: A critical review,False
1025,19,,10.1002/mds.25517,10.1097/wnr.0b013e3283525b39,"joundi ra, brittain js, punt td, green al, jenkinson n, aziz tz. stimulation of the subthalamic nucleus improves velocity of ballistic movements in parkinson' s disease.   apr;23(6):390-4.",stimulation of the subthalamic nucleus improves velocity of ballistic movements in parkinson's disease,Pathological crying after subthalamic nucleus stimulation,Stimulation of the subthalamic nucleus improves velocity of ballistic movements in Parkinson’s disease,False
1049,530,,10.1002/jmri.25340,10.1016/j.jcmg.2012.10.030,"karamitsos td, neubauer s. detecting diffuse myocardial fibrosis with cmr: the future has only just begun.   jun;6(6):684-6.",detecting diffuse myocardial fibrosis with cmr: the future has only just begun,Endogenous assessment of diffuse myocardial fibrosis in patients with T1ρ-mapping,Detecting Diffuse Myocardial Fibrosis With CMR,False
1059,234,,10.1111/pedi.12289,10.2217/dmt.12.82,"kavvoura fk, owen kr. maturity onset diabetes of the young: clinical characteristics, diagnosis and management.   dec;10(2):234-42.","maturity onset diabetes of the young: clinical characteristics, diagnosis and management",Characteristics of maturity onset diabetes of the young in a large diabetes center,Biomarkers currently used for the diagnosis of maturity-onset diabetes of the young,False
1103,771,,10.1111/jopy.12018,10.1378/chest.13-1096,"kohler m, stradling jr. osa and hypertension  -  do we know all the answers?.   nov 30;144(5):1433-34.",osa and hypertension  -  do we know all the answers?,What Do We Know When We Know a PersonAcross Contexts? Examining Self-Concept Differentiation at the Three Levels of Personality,OSA and Hypertension,False
1105,4,,10.3724/sp.j.1206.2012.00034,10.1007/s00702-011-0732-4,"kolsch h, lehmann dj, ibrahim-verbaas ca, combarros o, van duijn cm, hammond n, belbin o, cortina-borja m,  g lehmann mg, aulchenko ys, schuur m, breteler m, wilcock gk, brown k, kehoe pg, barber r, coto e, alvarez v,  deloukas p, mateo i, maier w, morgan k, warden dk, smith ad, heun r . interaction of insulin and ppar-alpha genes in alzheimer' s disease: the epistasis project.   apr;119:473-9.",interaction of insulin and ppar-alpha genes in alzheimer's disease: the epistasis project,Role of Neprilysin in The Pathogenesis of Alzheimer′s Disease*,Interaction of insulin and PPAR-α genes in Alzheimer’s disease: the Epistasis Project,False
1133,861,,10.1111/j.1470-6431.2010.00924.x,10.1093/pubmed/fdv112,"lang s, ford kj, john t, pollard aj, mccarthy nd. immunisation errors reported to a vaccine advice service: intelligence to improve practice.   jan;22(3):139-46.",immunisation errors reported to a vaccine advice service: intelligence to improve practice,Energy advice service as perceived by Swedish homeowners,A quantitative review of healthcare professionals' questions to a local immunization advice service: 4299 enquiries from 3 years,False
1135,812,,10.1111/cge.12006,10.1111/cge.12006,"lange la, hu y, zhang h, xue c, schmidt em, tang zz et al. whole-exome sequencing identifies rare and low-frequency coding variants associated with ldl cholesterol.   feb;94(2):233-45.",whole-exome sequencing identifies rare and low-frequency coding variants associated with ldl cholesterol,"Whole exome sequencing identifies a novelDFNA9mutation, C162Y","Whole exome sequencing identifies a novelDFNA9mutation, C162Y",False
1147,269,10.1007/8904_2012_140,10.1002/pd.4757,10.1016/j.fertnstert.2013.07.1373,"lavery s, abdo d, kotrotsou m, trew g, konstantinidis m, wells d. successful live birth following preimplantation genetic diagnosis of phenylketonuria in day 3 embryos by specific mutation analysis and elective single embryo transfer.   jan;7:49-54. doi: 10.1007/8904_2012_140. epub 2012 mar 31.",successful live birth following preimplantation genetic diagnosis of phenylketonuria in day 3 embryos by specific mutation analysis and elective single embryo transfer,Current controversies in prenatal diagnosis 4: preimplantation genetic screening should be routinely offered to all preimplantation genetic diagnosis cases,Clinical pregnancy following preimplantation genetic testing for branchi-oto-renal syndrome,False
1166,675,,10.1002/lary.25260,10.1161/circulationaha.113.005375,"leeson p, thilaganathan b. assisted reshaping of the fetal heart?.   sep 24;128(13):1398-9.",assisted reshaping of the fetal heart?,Laser-assisted cartilage reshaping for protruding ears: A review of the clinical applications,“Assisted” Reshaping of the Fetal Heart?,False
1167,1716,10.1007/s00439-015-1616-8,10.1111/cge.12256,10.1016/j.yonc.2011.10.003,"lei j, rudolph a, moysich kb, behrens s, goode el, bolla mk et al. genetic variation in the immunosuppression pathway genes and breast cancer susceptibility: a pooled analysis of 42,510 cases and 40,577 controls from the breast cancer association consortium.   jan;135(1):137-54. doi: 10.1007/s00439-015-1616-8. epub 2015 nov 30.","genetic variation in the immunosuppression pathway genes and breast cancer susceptibility: a pooled analysis of 42,510 cases and 40,577 controls from the breast cancer association consortium",The impact of next generation sequencing on the analysis of breast cancer susceptibility: a role for extremely rare genetic variation?,Associations of Breast Cancer Risk Factors With Tumor Subtypes: A Pooled Analysis From the Breast Cancer Association Consortium Studies,False
1190,742,,10.1111/jon.12556,10.1161/strokeaha.113.002775,"li l, simoni m, kã•_ker w, schulz ug, christie s, wilcock gk, rothwell pm, kuker w. population-based case-control study of white matter changes on brain imaging in transient ischemic attack and ischemic stroke.   nov;44(11):3063-70.",population-based case-control study of white matter changes on brain imaging in transient ischemic attack and ischemic stroke,White Matter Degeneration after Ischemic Stroke: A Longitudinal Diffusion Tensor Imaging Study,Population-Based Case–Control Study of White Matter Changes on Brain Imaging in Transient Ischemic Attack and Ischemic Stroke,False
1198,83,,None,10.1093/cid/cis327,"lillie, p. j., berthoud, t. k., powell, t. j., lambe, t., mullarkey, c., spencer, a. j., ... & sheehy, s. h. (2012). preliminary assessment of the efficacy of a t-cell–based influenza vaccine, mva-np+ m1, in humans. clinical infectious diseases, 55(1), 19-25.","preliminary assessment of the efficacy of a t-cell-based influenza vaccine, mva-np+m1, in humans",,"Preliminary Assessment of the Efficacy of a T-Cell–Based Influenza Vaccine, MVA-NP+M1, in Humans",False
1225,794,,10.1002/hbm.23299,10.1371/journal.pone.0082762,"little s, tan h, anzak a, pogosyan a, kã•_hn a, brown p. bilateral functional connectivity of the basal ganglia in patients with parkinson' s disease and its modulation by dopaminergic treatment.   dec;8:e82762.",bilateral functional connectivity of the basal ganglia in patients with parkinson's disease and its modulation by dopaminergic treatment,Longitudinal changes in functional connectivity of cortico-basal ganglia networks in manifests and premanifest huntington's disease,Bilateral Functional Connectivity of the Basal Ganglia in Patients with Parkinson’s Disease and Its Modulation by Dopaminergic Treatment,False
1230,889,,10.1002/ijc.28073,10.1158/0008-5472.can-13-2319,"liu s, knapp s, ahmed aa. the structural basis of pi3k cancer mutations.   feb 1;74(3):641-6.",the structural basis of pi3k cancer mutations,"Coexistent mutations ofKRASandPIK3CAaffect the efficacy of NVP-BEZ235, a dual PI3K/MTOR inhibitor, in regulating the PI3K/MTOR pathway in colorectal cancer",The Structural Basis of PI3K Cancer Mutations: From Mechanism to Therapy,False
1294,1723,10.3978/j.issn.2305-5839.2015.09.12,10.1111/j.1365-2222.2010.03681.x,10.4038/cmj.v57i3.4701,"malavige gn, ogg gs.. role of skin homing t cells in acute dengue infection..   oct;3(17):252. doi: 10.3978/j.issn.2305-5839.2015.09.12.",role of skin homing t cells in acute dengue infection.,Skin-homing CD4+ Foxp3+ T cells exert Th2-like function after staphylococcal superantigen stimulation in atopic dermatitis patients,Pathogenesis of severe dengue infection,False
1300,1484,10.1212/WNL.0000000000001606,10.1161/strokeaha.113.002707,10.1177/0333102414547784,"malik r, freilinger t, winsvold bs, anttila v, vander heiden j, traylor m, de vries b, holliday eg, terwindt gm, sturm j, bis jc, hopewell jc, ferrari md, rannikmae k, wessman m, kallela m, kubisch c, fornage m, meschia jf, lehtimã•_ki t, sudlow c, clarke r, chasman di, mitchell bd, maguire j, kaprio j, farrall m, raitakari ot, kurth t, ikram ma, reiner ap, longstreth wt jr, rothwell pm, strachan dp, sharma p, seshadri s, quaye l, cherkas l, schã•_rks m, rosand j, ligthart l, boncoraglio gb, davey smith g, van duijn cm, stefansson k, worrall bb, nyholt dr, markus hs, van den maagdenberg am, cotsapas c, zwart ja, palotie a; international headache genetics consortium, dichgans m; metastroke collaboration of the international stroke genetics consortium. shared genetic basis for migraine and ischemic stroke: a genome-wide analysis of common variants.   may 26;84(21):2132-2145.  doi: 10.1212/wnl.0000000000001606",shared genetic basis for migraine and ischemic stroke: a genome-wide analysis of common variants,Shared Genetic Susceptibility to Ischemic Stroke and Coronary Artery Disease,Concordance of genetic risk across migraine subgroups: Impact on current and future genetic association studies,False
1320,200,,10.1002/hbm.22733,10.1016/j.neuroimage.2012.10.088,"marreiros ac, cagnan h, moran rj, friston kj, brown p. basal ganglia-cortical interactions in parkinsonian patients.   nov;66:301-10.",basal ganglia-cortical interactions in parkinsonian patients,Basal ganglia-cortical structural connectivity in Huntington's disease,Basal ganglia–cortical interactions in Parkinsonian patients,False
1429,2036,,None,10.3233/jad-141764,"mohamed ne, lee jh, francis pt, esiri mm, chen cp, lai mk.. differential alterations of neocortical glun receptor subunits in patients with mixed ischemic vascular dementia and alzheimer's disease..   jan 1;44 (2):431-7.",differential alterations of neocortical glun receptor subunits in patients with mixed ischemic vascular dementia and alzheimer's disease.,,Differential Alterations of Neocortical GluN Receptor Subunits in Patients with Mixed Subcortical Ischemic Vascular Dementia and Alzheimer's Disease,False
1431,170,,None,10.1007/s10072-011-0874-z,"molinari m, nichelli pf, panzetti p, pugnaghi m, zamboni g. ""my sister' s hand is in my bed"": a case of somatoparaphrenia.   oct;33(5):1205-7.",my sister’s hand is in my bed: a case of somatoparaphrenia,,“My sister’s hand is in my bed”: a case of somatoparaphrenia,False
1434,723,,None,10.1186/1532-429x-15-92,"moon jc, messroghli dr, kellman p, piechnik sk, robson md, ugander m, gatehouse pd, arai ae, friedrich mg, neubauer s, schulz-menger j, schelbert eb. myocardial t1 mapping and extracellular volume quantification: a society for cardiovascular magnetic resonance (scmr) and cmr working group of the society of cardiology consensus statement.   oct 14;15(1):92.",myocardial t1 mapping and extracellular volume quantification: a society for cardiovascular magnetic resonance (scmr) and cmr working group of the society of cardiology consensus statement,,Myocardial T1 mapping and extracellular volume quantification: a Society for Cardiovascular Magnetic Resonance (SCMR) and CMR Working Group of the European Society of Cardiology consensus statement,False
1437,1971,,None,10.1037/pas0000327,"morandi s, golay p, vazquez-montes m, rugkã¥sa j, molodynski a, yeeles k, burns t. factorial structure and long-term stability of the autonomy preference index.   apr. epub ahead of print.",factorial structure and long-term stability of the autonomy preference index,,Factorial structure and long-term stability of the Autonomy Preference Index.,False
1454,2340,,None,10.1186/s12885-015-1062-y,"mukherjee s, hurt cn, gwynne s, sebag-montefiore d, radhakrishna g, gollins s, et al. neoscope: a randomised phase ii study of induction chemotherapy followed by oxaliplatin/capecitabine or carboplatin/paclitaxel based pre-operative chemoradiation for resectable oesophageal adenocarcinoma. eur j cancer. 2017;74:38-46.",neoscope: a randomised phase ii study of induction chemotherapy followed by oxaliplatin/capecitabine or carboplatin/paclitaxel based pre-operative chemoradiation for resectable oesophageal adenocarcinoma.,,NEOSCOPE: a randomised Phase II study of induction chemotherapy followed by either oxaliplatin/capecitabine or paclitaxel/carboplatin based chemoradiation as pre-operative regimen for resectable oesophageal adenocarcinoma,False
1458,2251,,None,10.1186/bcr2874,"muranen ta, greco d, blomqvist c, aittomaki k, khan s, hogervorst f et al. genetic modifiers of chek2*1100delc-associated breast cancer risk.   oct 6. pubmed pmid: 27711073. epub 2016/10/07. eng.",genetic modifiers of chek2*1100delc-associated breast cancer risk,,Breast tumors from CHEK2 1100delC mutation carriers: genomic landscape and clinical implications,False
1478,679,,10.1002/ajh.24270,10.1200/jco.2013.48.8114,"nagler a, rocha v, labopin m, unal a, ben othman t, campos a et al. allogeneic hematopoietic stem-cell transplantation for acute myeloid leukemia in remission: comparison of intravenous busulfan plus cyclophosphamide (cy) versus total-body irradiation plus cy as conditioning regimen - a report from the acute leukemia working party of the european group for blood and marrow transplantation.   oct;31(28):3549-56.",allogeneic hematopoietic stem-cell transplantation for acute myeloid leukemia in remission: comparison of intravenous busulfan plus cyclophosphamide (cy) versus total-body irradiation plus cy as conditioning regimen - a report from the acute leukemia working party of the european group for blood and marrow transplantation,Impact of age on outcomes of allogeneic hematopoietic stem cell transplantation with reduced intensity conditioning in elderly patients with acute myeloid leukemia,Allogeneic Hematopoietic Stem-Cell Transplantation for Acute Myeloid Leukemia in Remission: Comparison of Intravenous Busulfan Plus Cyclophosphamide (Cy) Versus Total-Body Irradiation Plus Cy As Conditioning Regimen—A Report From the Acute Leukemia Working Party of the European Group for Blood and Marrow Transplantation,False
1515,146,,10.1002/uog.15777,10.1093/humrep/des219,"noble j, poli m, griffiths t, emerson g, wells d, filho es. a method for semi-automatic grading of human blastocysts.   sep;27(9):2641-8.",a method for semi-automatic grading of human blastocysts,Semi-automatic outlining of levator hiatus,A method for semi-automatic grading of human blastocyst microscope images,False
1549,793,,10.3724/sp.j.1206.2010.00393,10.1097/wco.0000000000000034,"oswal a, brown p, litvak v. synchronised neural oscillations and the pathophysiology of parkinson' s disease..   dec;26:662-70.",synchronised neural oscillations and the pathophysiology of parkinson's disease.,DJ-1 and Parkinson′s Disease*,Synchronized neural oscillations and the pathophysiology of Parkinsonʼs disease,False
