,ID,DOI,DOI_API,DOI_retry_API,complete,csv_post_title,title_API,title_retry_API,good_list
1794,1618,10.1080/19420862.2015.1100787,None,,"roncador g, engel p, maestre l, anderson ap, cordell jl, cragg ms, â_erbec v""”ã”, jones m, lisnic vj, kremer l, li d, koch-nolte f, pascual n, rodrã•_guez-barbosa j, torensma r, turley h, pulford k, banham ah. the european antibody network' s practical guide to finding and validating suitable antibodies for research.   jan 2;8(1):27-36. doi: 10.1080/19420862.2015.1100787. epub 2015 sep 29..",the european antibody network's practical guide to finding and validating suitable antibodies for research,,,False
1795,258,,None,,"roos-weil d, dietrich s, boumendil a, polge e, bron d, carreras e et al. stem cell transplantation can provide durable disease control in blastic plasmacytoid dendritic cell neoplasm: a retrospective study from the european group for blood and marrow transplantation.   jan;121(3):440-6.",stem cell transplantation can provide durable disease control in blastic plasmacytoid dendritic cell neoplasm: a retrospective study from the european group for blood and marrow transplantation,,,False
1796,339,,None,,"rosenthal cr, ng tw, kennard c. generalisation of new sequence knowledge depends on response modality.   feb;8(2):e53990.",generalisation of new sequence knowledge depends on response modality,,,False
1825,1239,,10.3724/sp.j.1206.2010.00393,10.1093/brain/awu308,"ryan bj, crabtree mj, channon km, wade-martins r. parkinson' s disease in gtp cyclohydrolase 1 mutation carriers.   nov 14.",parkinson's disease in gtp cyclohydrolase 1 mutation carriers,DJ-1 and Parkinson′s Disease*,Parkinson’s disease in GTP cyclohydrolase 1 mutation carriers,False
1832,673,,None,10.1016/j.jalz.2013.04.043,"sabater-lleal m, huang j, chasman d, naitza s, dehghan a, johnson ad et al. multiethnic meta-analysis of genome-wide association studies in >100 000 subjects identifies 23 fibrinogen-associated loci but no strong evidence of a causal association between circulating fibrinogen and cardiovascular disease.   sep 17;128(12):1310-24.",multiethnic meta-analysis of genome-wide association studies in >100 000 subjects identifies 23 fibrinogen-associated loci but no strong evidence of a causal association between circulating fibrinogen and cardiovascular disease,,Analysis of loci from genome-wide association studies of many complex traits for association with late-onset Alzheimer's disease (LOAD) identifies potentially pleiotropic variants,False
1839,2198,,10.1111/j.1553-2712.2011.01190.x,10.2139/ssrn.2373935,"sahan km, channon km, choudhury rp, kharbanda rk, lee r, sheehan m. refining the enrolment process in emergency medicine research.   apr;4(1):506-510.",refining the enrolment process in emergency medicine research,Emergency Medicine Research: To Infinity and Beyond!,"Mirror Up to KM Paradoxes and Strategy Paradoxes: An Exploratory Account (Extending and Refining the Theory Based Framework of Schultze and Stabell: Discourses, Contradictions in KM Research)",False
1870,223,,10.1002/eji.201444830,10.1016/s0168-8278(12)60059-2,"schmidt j, iversen akn, tenzer s, gostick e, price da, lohmann v, distler u, bowness p, schild h, blum he,  klenerman p, neumann-haefelin c, thimme r. rapid antigen processing.   nov.",rapid antigen processing,Polyubiquitination of lysine-48 is an essential but indirect signal for MHC class I antigen processing,45 RAPID AND EFFICIENT ANTIGEN PROCESSING AND PRESENTATION OF A PROTECTIVE AND IMMUNODOMINANT HLA-B*27-RESTRICTED HEPATITIS C VIRUS-SPECIFIC CD8+ T CELL EPITOPE,False
1890,1611,,10.1002/jmri.25998,10.1016/j.yebeh.2018.03.016,"sen a, selway r and nashe l. from channels to commissioning  -  a practical guide to epilepsy.   sep. in: rugg-gunn fj, smalls je, editors.",from channels to commissioning  -  a practical guide to epilepsy,Practical guide to dynamic pelvic floor MRI,Bitemporal seizure spread and its effect on autonomic dysfunction,False
1966,1612,,10.1111/epi.12000,10.14581/jer.17012,"sommerville er, michell aw, gabapenti sen a. the treatment of epilepsy.   sep. in: shorvon sd, perucca e, and engel j, editors. 4th ed. wiley.",the treatment of epilepsy,Novel approaches to epilepsy treatment,Cannabinoids in the Treatment of Epilepsy: Hard Evidence at Last?,False
1990,914,,10.1002/cncr.27379,10.1093/jnci/dju007,"stattin p, carlsson s, holmstrã•_m b, vickers a, hugosson j, lilja h, jonsson h. prostate cancer mortality in areas with high and low prostate cancer incidence.   mar 1;106(dju007). [epub 2014 mar 7].",prostate cancer mortality in areas with high and low prostate cancer incidence.,Explaining racial differences in prostate cancer mortality,Prostate Cancer Mortality in Areas With High and Low Prostate Cancer Incidence,False
2023,1500,10.1016/j.urolonc.2014.08.007,10.1002/pros.22831,10.1016/s1569-9056(14)60630-8,"surcel ci, van oort im, sooriakumaran p, briganti a, de visschere pj, fã•_tterer jj, ghadjar p, isbarn h, ost p, van den bergh rc, yossepowitch o, giannarini g, ploussard g; members of the prostate cancer working group of the young academic urologists working party of the european association of urology. prognostic effect of neuroendocrine differentiation in prostate cancer: a critical review.   jun;33(6):265.e1-7. doi: 10.1016/j.urolonc.2014.08.007. epub 2014 sep 17..",prognostic effect of neuroendocrine differentiation in prostate cancer: a critical review,Utility of FDG-PET in clinical neuroendocrine prostate cancer,640 Current trends in management of high-risk prostate cancer in Europe: Results of a web-based survey by the Prostate Cancer Working Group of the Young Academic Urologists Working Party of the European Association of Urology,False
2105,1870,10.1016/j.jcmg.2015.11.008,10.1002/ar.23915,10.1136/heartjnl-2015-307845.29,"treibel ta, fontana m, maestrini v, castelletti s, rosmini s, simpson j et al. automatic measurement of the myocardial interstitium: synthetic extracellular volume quantification without hematocrit sampling.   jan;9(1):54-63. doi: 10.1016/j.jcmg.2015.11.008..",automatic measurement of the myocardial interstitium: synthetic extracellular volume quantification without hematocrit sampling,Development of the Myocardial Interstitium,29 Synthetic ECV – simplifying ECV quantification by deriving haematocrit from T1 blood,False
2121,1781,10.1183/13993003.congress-2015.pa2413,10.1111/resp.13144,10.1136/thoraxjnl-2015-207770.35,"turnbull cd, bratton dj, craig se, kohler m, stradling jr. in patients with minimally symptomatic osa can baseline characteristics and early patterns of cpap usage predict those who are likely to be longer-term users of cpap.   feb;8(2):276-281. doi:10.3978/j.issn.2072-1439.2016.01.54.",in patients with minimally symptomatic osa can baseline characteristics and early patterns of cpap usage predict those who are likely to be longer-term users of cpap,Treating OSA: Current and emerging therapies beyond CPAP,S29 Predictors of continuous positive airways pressure usage at six months in minimally symptomatic patients. Further data from the MOSAIC trial: Abstract S29 Table 1,False
2122,1169,,10.1002/eat.22523,10.1136/thoraxjnl-2013-204826,"turnbull cd, craig se, kohler m, nicoll d, stradling j. cardiovascular event rates in the mosaic trial: 2-year follow-up data.   oct;69(10):950.",cardiovascular event rates in the mosaic trial: 2-year follow-up data,Two-year follow-up of the MOSAIC trial: A multicenter randomized controlled trial comparing two psychological treatments in adult outpatients with broadly defined anorexia nervosa,Cardiovascular event rates in the MOSAIC trial: 2-year follow-up data: Table 1,False
2155,819,,10.1111/j.1460-9568.2012.08086.x,10.1371/journal.pone.0086496,"van hartevelt tj, cabral j, deco g, mã•ã´ller a, green al, aziz tz, kringelbach ml. neural plasticity in human brain connectivity: the effects of long term deep brain stimulation of the subthalamic nucleus in parkinson' s disease.   jan.",neural plasticity in human brain connectivity: the effects of long term deep brain stimulation of the subthalamic nucleus in parkinson's disease,Spatiotemporal visualization of deep brain stimulation-induced effects in the subthalamic nucleus,Neural Plasticity in Human Brain Connectivity: The Effects of Long Term Deep Brain Stimulation of the Subthalamic Nucleus in Parkinson’s Disease,False
2162,208,,10.1111/j.1464-5491.2011.03257.x,10.1038/oby.2012.64,"vasan sk, fall t, neville mj, antonisamy b, fall ch, geethanjali fs, gu hf, raghupathy p, samuel p, thomas n, brismar k, ingelsson e, karpe f. associations of variants in fto and near mc4r with obesity traits in south asian indians.   nov;20(11):2268-77.",associations of variants in fto and near mc4r with obesity traits in south asian indians,An FTO variant is associated with Type 2 diabetes in South Asian populations after accounting for body mass index and waist circumference,Associations of Variants inFTOand NearMC4RWith Obesity Traits in South Asian Indians,False
2181,901,10.1117/12.2038377,10.1002/jso.23946,10.1186/s13104-015-1576-z,"volpi d, tullis idc, laios a, pathiraja pnj, haldar k, ahmed aa, vojnovic d. a novel multiwavelength fluorescence image-guided surgery imaging system.  from conference volume 8935  feb 27. doi:10.1117/12.2038377; http://dx.doi.org/10.1117/12.2038377 .",a novel multiwavelength fluorescence image-guided surgery imaging system,A ratiometric threshold for determining presence of cancer during fluorescence-guided surgery,A prospective pilot study of detection of sentinel lymph nodes in gynaecological cancers using a novel near infrared fluorescence imaging system,False
2230,2140,10.1016/B978-0-444-63432-0.00009-8,10.3724/sp.j.1206.2012.00010,10.1016/s0140-6736(14)60374-3,"waters p, pettingill p, lang b. detection methods for neural autoantibodies..   sep(133):147-63. doi: 10.1016/b978-0-444-63432-0.00009-8..",detection methods for neural autoantibodies.,Methods for Autophagy Detection*,Autoantibodies to the N-methyl-D-aspartate receptor and seizure susceptibility in mice,False
2241,171,,None,10.1161/strokeaha.112.655837,"webb aj, simoni m, mazzucco s, kuker w, schulz u, rothwell pm. increased cerebral arterial pulsatility in patients with leukoaraiosis: arterial stiffness enhances transmission of aortic pulsatility.   oct;43(10):2631-6.",increased cerebral arterial pulsatility in patients with leukoaraiosis: arterial stiffness enhances transmission of aortic pulsatility,,Increased Cerebral Arterial Pulsatility in Patients With Leukoaraiosis,False
2257,610,,10.1002/path.4094,,"whiffin n, dobbins se, hosking fj, palles c, tenesa a, wang y, farrington sm, jones am, broderick p, campbell h, newcomb pa, casey g, conti dv, schumacher f, gallinger s, lindor nm, hopper j, jenkins m, dunlop mg, tomlinson ip, houlston rs. deciphering the genetic architecture of low-penetrance susceptibility to colorectal cancer.   aug 7. epub ahead of print.",deciphering the genetic architecture of low-penetrance susceptibility to colorectal cancer,Deciphering the epigenetic network in colorectal cancer,,False
2287,2293,,None,10.1212/wnl.0000000000003183,"wilson, d., charidimou, a., ambler, g., fox, z. v., gregoire, s., rayson, p., ... & veltkamp, r. (2016). recurrent stroke risk and cerebral microbleed burden in ischemic stroke and tia a meta-analysis. neurology, 87(14), 1501-1510.",recurrent stroke risk and cerebral microbleed burden in ischemic stroke and tia: a meta-analysis,,Recurrent stroke risk and cerebral microbleed burden in ischemic stroke and TIA,False
2288,1669,10.1371/journal.pgen.1005378,None,10.1371/journal.pone.0132846,"winkler tw, justice ae, graff m, barata l, feitosa mf, chu s et al. the influence of age and sex on genetic associations with adult body size and shape: a large-scale genome-wide interaction study.   oct;11(10):e1005378. doi: 10.1371/journal.pgen.1005378. ecollection 2015.",the influence of age and sex on genetic associations with adult body size and shape: a large-scale genome-wide interaction study,,Genome-Wide Association Study on Male Genital Shape and Size in Drosophila melanogaster,False
2290,1021,,None,10.1016/j.ccr.2014.03.036,"woll ps, kjã•_llquist u, chowdhury o, doolittle h, wedge dc, thongjuea s, erlandsson r, ngara m, anderson k, deng q, mead aj, stenson l, giustacchini a, duarte s, giannoulatou e, taylor s, karimi m, scharenberg c, mortera-blanco t, macaulay ic, clark sa, dybedal i, josefsen d, fenaux p, hokland p, holm ms, cazzola m, malcovati l, tauro s, bowen d, boultwood j, pellagatti a, pimanda je, unnikrishnan a, vyas p, gã•_hring g, schlegelberger b, tobiasson m, kvalheim g, constantinescu sn, nerlov c, nilsson l, campbell pj, sandberg r, papaemmanuil e, hellstrã•_m-lindberg e, linnarsson s, jacobsen se. myelodysplastic syndromes are propagated by rare and distinct human cancer stem cells in vivo.   jun;25(6):794-808.",myelodysplastic syndromes are propagated by rare and distinct human cancer stem cells in vivo,,Myelodysplastic Syndromes Are Propagated by Rare and Distinct Human Cancer Stem Cells In Vivo,False
2297,557,,None,10.1038/leu.2013.276,"wong kk, gascoyne dm, brown pj, soilleux ej, snell c, chen h et al. reciprocal expression of the endocytic protein hip1r and its repressor foxp1 predicts outcome in r-chop-treated diffuse large b-cell lymphoma patients.   jul;25(10):224.",reciprocal expression of the endocytic protein hip1r and its repressor foxp1 predicts outcome in r-chop-treated diffuse large b-cell lymphoma patients,,Erratum: Reciprocal expression of the endocytic protein HIP1R and its repressor FOXP1 predicts outcome in R-CHOP-treated diffuse large B-cell lymphoma patients,False
2301,1231,10.1038/ng.3097,None,10.1038/nprot.2014.071,"wood ar, esko t, yang j, vedantam s, pers th, gustafsson s, chu ay, estrada k, luan j, kutalik z, amin n, buchkovich ml, croteau-chonka dc, day fr, duan y, fall t, fehrmann r, ferreira t, jackson au, karjalainen j, lo ks, locke ae, mã•_gi r, mihailov e, porcu e, randall jc, scherag a, vinkhuyzen aa, westra hj, winkler tw, workalemahu t, zhao jh, magi r et al. defining the role of common variation in the genomic and biological architecture of adult human height.   nov 2;46(11):1173-86. doi: 10.1038/ng.3097 epub 2014 oct 5.",defining the role of common variation in the genomic and biological architecture of adult human height,,Quality control and conduct of genome-wide association meta-analyses,False
2305,101,,None,10.1037/a0024992,"woud ml, holmes ea, postma p, dalgleish t, mackintosh b. ameliorating intrusive memories of distressing experiences using computerized reappraisal training.   aug;12(4):778-84.",ameliorating intrusive memories of distressing experiences using computerized reappraisal training,,Ameliorating intrusive memories of distressing experiences using computerized reappraisal training.,False
2306,625,,None,10.1016/j.jbtep.2013.01.003,"woud ml, holmes ea, postma p, dalgleish t, mackintosh b. reducing analogue trauma symptoms by computerized reappraisal training  -  considering a cognitive prophylaxis?.   sep 12;4:778.",reducing analogue trauma symptoms by computerized reappraisal training  -  considering a cognitive prophylaxis?,,Reducing analogue trauma symptoms by computerized reappraisal training – Considering a cognitive prophylaxis?,False
2348,637,,10.1111/bdi.12047,10.1016/j.biopsych.2013.04.015,"zamboni g, wilcock gk, douaud g, drazich e, mcculloch e, filippini n, tracey i, brooks jc, smith sm, jenkinson m, mackay ce. resting functional connectivity reveals residual functional activity in alzheimer' s disease.   sep 1;74(5):375-83.",resting functional connectivity reveals residual functional activity in alzheimer's disease,Differences in resting corticolimbic functional connectivity in bipolar I euthymia,Resting Functional Connectivity Reveals Residual Functional Activity in Alzheimer’s Disease,False
